{
  "name": "factory-cyber-range-demo",
  "title": "隔离工控网络安全靶场示例",
  "review": {"status": "approved"},
  "isolation": {"production_bridge": false, "internet_egress": false},
  "zones": [
    {"id": "dmz", "name": "DMZ"},
    {"id": "control", "name": "生产工控网"}
  ],
  "nodes": [
    {"id": "boundary-fw", "name": "边界防火墙", "type": "firewall", "zone": "dmz"},
    {"id": "dmz-switch", "name": "DMZ 交换机", "type": "switch", "zone": "dmz"},
    {"id": "control-switch", "name": "工控交换机", "type": "industrial_switch", "zone": "control"},
    {"id": "engineering-station", "name": "工程师站", "type": "workstation", "zone": "control"},
    {"id": "plc-01", "name": "PLC-01", "type": "plc", "zone": "control"}
  ],
  "links": [
    {"id": "l1", "source": "boundary-fw", "target": "dmz-switch", "protocol": "ethernet"},
    {"id": "l2", "source": "dmz-switch", "target": "control-switch", "protocol": "ethernet"},
    {"id": "l3", "source": "control-switch", "target": "engineering-station", "protocol": "ethernet"},
    {"id": "l4", "source": "control-switch", "target": "plc-01", "protocol": "profinet"}
  ]
}